review,tokens,explicit aspects,explicit opinion,implicit aspects,implicit opinion,is_suggestion,explicit aspects positions,explicit opinion positions,aspect_tags,review_number,total_aspects,has_aspect,fold
Produto entregue antes do prazo previsto nota 10 amei produto recomendo ótima qualidade parabéns pela qualidade e atendimento acompanhei o produto dês do depósito até a entrega obrigado,"['Produto', 'entregue', 'antes', 'do', 'prazo', 'previsto', 'nota', '10', 'amei', 'produto', 'recomendo', 'ótima', 'qualidade', 'parabéns', 'pela', 'qualidade', 'e', 'atendimento', 'acompanhei', 'o', 'produto', 'dês', 'do', 'depósito', 'até', 'a', 'entrega', 'obrigado']",[],[],[],[],,[],[],"['O', 'O', 'O', 'O', 'O', 'O', 'O', 'O', 'O', 'O', 'O', 'O', 'O', 'O', 'O', 'O', 'O', 'O', 'O', 'O', 'O', 'O', 'O', 'O', 'O', 'O', 'O', 'O']",296,0,0,8
"Estamos muito felizes com a Smart TV LED 32"""" Samsung 32J4300 HD com Conversor Digital 2 HDMI 1 USB Wi-Fi 120Hz. É linda e tem o tamanho ideal para o que precisávamos. Imagem/resolução muito bons. Todas as funções conforme a descrição. Chegou no último dia do prazo de entrega, mas veio em perfeito estado!","['Estamos', 'muito', 'felizes', 'com', 'a', 'Smart', 'TV', 'LED', '32', '""', '""', 'Samsung', '32J4300', 'HD', 'com', 'Conversor', 'Digital', '2', 'HDMI', '1', 'USB', 'Wi-Fi', '120Hz', '.', 'É', 'linda', 'e', 'tem', 'o', 'tamanho', 'ideal', 'para', 'o', 'que', 'precisávamos', '.', 'Imagem', '/', 'resolução', 'muito', 'bons', '.', 'Todas', 'as', 'funções', 'conforme', 'a', 'descrição', '.', 'Chegou', 'no', 'último', 'dia', 'do', 'prazo', 'de', 'entrega', ',', 'mas', 'veio', 'em', 'perfeito', 'estado', '!']","['smart tv led 32""""', 'tamanho', 'imagem/resolução', 'funções', 'prazo de entrega']","['muito felizes', 'ideal', 'muito bons', 'muito bons', 'chegou no último dia do prazo']",['design'],['linda'],,"[[5, 11], [29, 30], [36, 39], [44, 45], [54, 57]]","[[1, 3], [30, 31], [39, 41], [39, 41], [49, 55]]","['O', 'O', 'O', 'O', 'O', 'B-ASP', 'I-ASP', 'I-ASP', 'I-ASP', 'I-ASP', 'I-ASP', 'O', 'O', 'O', 'O', 'O', 'O', 'O', 'O', 'O', 'O', 'O', 'O', 'O', 'O', 'O', 'O', 'O', 'O', 'B-ASP', 'O', 'O', 'O', 'O', 'O', 'O', 'B-ASP', 'I-ASP', 'I-ASP', 'O', 'O', 'O', 'O', 'O', 'B-ASP', 'O', 'O', 'O', 'O', 'O', 'O', 'O', 'O', 'O', 'B-ASP', 'I-ASP', 'I-ASP', 'O', 'O', 'O', 'O', 'O', 'O', 'O']",948,5,1,8
"A imagem do YouTube não é nítida! Espero que seja algum erro de configuração, mas até agora eu não consegui ajustar.","['A', 'imagem', 'do', 'YouTube', 'não', 'é', 'nítida', '!', 'Espero', 'que', 'seja', 'algum', 'erro', 'de', 'configuração', ',', 'mas', 'até', 'agora', 'eu', 'não', 'consegui', 'ajustar', '.']",['imagem do youtube'],['não é nítida'],[],[],,"[[1, 4]]","[[4, 7]]","['O', 'B-ASP', 'I-ASP', 'I-ASP', 'O', 'O', 'O', 'O', 'O', 'O', 'O', 'O', 'O', 'O', 'O', 'O', 'O', 'O', 'O', 'O', 'O', 'O', 'O', 'O']",319,1,1,8
Pesquisei muito antes de comprar e optei pela sansung 32 otimo produto imagem surpreendente som otimo vi comentarios que som era baixo nao e muito bom chegou antes da data estou satisfeita,"['Pesquisei', 'muito', 'antes', 'de', 'comprar', 'e', 'optei', 'pela', 'sansung', '32', 'otimo', 'produto', 'imagem', 'surpreendente', 'som', 'otimo', 'vi', 'comentarios', 'que', 'som', 'era', 'baixo', 'nao', 'e', 'muito', 'bom', 'chegou', 'antes', 'da', 'data', 'estou', 'satisfeita']","['produto', 'imagem', 'som']","['otimo', 'surpreendente', 'otimo']",['entrega'],['chegou antes da data'],,"[[11, 12], [12, 13], [14, 15]]","[[10, 11], [13, 14], [15, 16]]","['O', 'O', 'O', 'O', 'O', 'O', 'O', 'O', 'O', 'O', 'O', 'B-ASP', 'B-ASP', 'O', 'B-ASP', 'O', 'O', 'O', 'O', 'O', 'O', 'O', 'O', 'O', 'O', 'O', 'O', 'O', 'O', 'O', 'O', 'O']",968,3,1,8
"tudo funcionando bem, ate agora satisfeito, apenas os encaixes para colocar os parafusos no suporte de parede nao serviram...","['tudo', 'funcionando', 'bem', ',', 'ate', 'agora', 'satisfeito', ',', 'apenas', 'os', 'encaixes', 'para', 'colocar', 'os', 'parafusos', 'no', 'suporte', 'de', 'parede', 'nao', 'serviram', '...']",['encaixes para colocar os parafusos'],['nao serviram'],['produto'],['funcionando bem'],,"[[10, 15]]","[[19, 21]]","['O', 'O', 'O', 'O', 'O', 'O', 'O', 'O', 'O', 'O', 'B-ASP', 'I-ASP', 'I-ASP', 'I-ASP', 'I-ASP', 'O', 'O', 'O', 'O', 'O', 'O', 'O']",308,1,1,8
"A TELEVISÃO É ÓTIMA: BOA IMAGEM, NÃO TRAVA QUANDO USA A INTERNET E O SOM É BEM ALTO. PRA MIM O ÚNICO DEFEITO FOI O SUPORTE QUE É MUITO FRÁGIL, PREFERI NÃO ME ARRISCAR E COMPREI UM SUPORTE PARA COLOCÁ-LA NA PAREDE. MAS É UM ÓTIMO APARELHO.","['A', 'TELEVISÃO', 'É', 'ÓTIMA', ':', 'BOA', 'IMAGEM', ',', 'NÃO', 'TRAVA', 'QUANDO', 'USA', 'A', 'INTERNET', 'E', 'O', 'SOM', 'É', 'BEM', 'ALTO', '.', 'PRA', 'MIM', 'O', 'ÚNICO', 'DEFEITO', 'FOI', 'O', 'SUPORTE', 'QUE', 'É', 'MUITO', 'FRÁGIL', ',', 'PREFERI', 'NÃO', 'ME', 'ARRISCAR', 'E', 'COMPREI', 'UM', 'SUPORTE', 'PARA', 'COLOCÁ-LA', 'NA', 'PAREDE', '.', 'MAS', 'É', 'UM', 'ÓTIMO', 'APARELHO', '.']","['televisão', 'imagem', 'internet', 'som', 'suporte', 'aparelho']","['ótima', 'boa', 'não trava', 'bem alto', 'muito frágil', 'ótimo']",[],[],,"[[1, 2], [6, 7], [13, 14], [16, 17], [28, 29], [51, 52]]","[[3, 4], [5, 6], [8, 10], [18, 20], [31, 33], [50, 51]]","['O', 'B-ASP', 'O', 'O', 'O', 'O', 'B-ASP', 'O', 'O', 'O', 'O', 'O', 'O', 'B-ASP', 'O', 'O', 'B-ASP', 'O', 'O', 'O', 'O', 'O', 'O', 'O', 'O', 'O', 'O', 'O', 'B-ASP', 'O', 'O', 'O', 'O', 'O', 'O', 'O', 'O', 'O', 'O', 'O', 'O', 'O', 'O', 'O', 'O', 'O', 'O', 'O', 'O', 'O', 'O', 'B-ASP', 'O']",998,6,1,8
"A TV e muito lenta custa a abri os app, quando desliga da tomada aí demora mais ainda para carregar novament","['A', 'TV', 'e', 'muito', 'lenta', 'custa', 'a', 'abri', 'os', 'app', ',', 'quando', 'desliga', 'da', 'tomada', 'aí', 'demora', 'mais', 'ainda', 'para', 'carregar', 'novament']",['tv'],['muito lenta'],[],[],,"[[1, 2]]","[[3, 5]]","['O', 'B-ASP', 'O', 'O', 'O', 'O', 'O', 'O', 'O', 'O', 'O', 'O', 'O', 'O', 'O', 'O', 'O', 'O', 'O', 'O', 'O', 'O']",342,1,1,8
"A Samsung por sua vez já tem o seu status de qualidade indiscutível, com o advento do sistema híbrido de TV adotado, a SMART TV, não deixa dúvida quanto a sua distinção entre suas congêneres.","['A', 'Samsung', 'por', 'sua', 'vez', 'já', 'tem', 'o', 'seu', 'status', 'de', 'qualidade', 'indiscutível', ',', 'com', 'o', 'advento', 'do', 'sistema', 'híbrido', 'de', 'TV', 'adotado', ',', 'a', 'SMART', 'TV', ',', 'não', 'deixa', 'dúvida', 'quanto', 'a', 'sua', 'distinção', 'entre', 'suas', 'congêneres', '.']",[],[],[],[],,[],[],"['O', 'O', 'O', 'O', 'O', 'O', 'O', 'O', 'O', 'O', 'O', 'O', 'O', 'O', 'O', 'O', 'O', 'O', 'O', 'O', 'O', 'O', 'O', 'O', 'O', 'O', 'O', 'O', 'O', 'O', 'O', 'O', 'O', 'O', 'O', 'O', 'O', 'O', 'O']",919,0,0,8
"O Custo foi muito bom e a qualidade do produto é excelente, a nitidez da imagem é impressionante, super recomendo. Americanas entregou em perfeito estado, e no prazo prometido.","['O', 'Custo', 'foi', 'muito', 'bom', 'e', 'a', 'qualidade', 'do', 'produto', 'é', 'excelente', ',', 'a', 'nitidez', 'da', 'imagem', 'é', 'impressionante', ',', 'super', 'recomendo', '.', 'Americanas', 'entregou', 'em', 'perfeito', 'estado', ',', 'e', 'no', 'prazo', 'prometido', '.']","['custo', 'produto', 'nitidez da imagem']","['muito bom', 'excelente', 'impressionante']",['entrega'],['perfeito estado'],,"[[1, 2], [9, 10], [14, 17]]","[[3, 5], [11, 12], [18, 19]]","['O', 'B-ASP', 'O', 'O', 'O', 'O', 'O', 'O', 'O', 'B-ASP', 'O', 'O', 'O', 'O', 'B-ASP', 'I-ASP', 'I-ASP', 'O', 'O', 'O', 'O', 'O', 'O', 'O', 'O', 'O', 'O', 'O', 'O', 'O', 'O', 'O', 'O', 'O']",183,3,1,8
"O produto é regular, tenho outra sansung que embora seja mais antiga, eu achei melhor. O som deixa a desejar","['O', 'produto', 'é', 'regular', ',', 'tenho', 'outra', 'sansung', 'que', 'embora', 'seja', 'mais', 'antiga', ',', 'eu', 'achei', 'melhor', '.', 'O', 'som', 'deixa', 'a', 'desejar']","['produto', 'som']","['regular', 'deixa a desejar']",[],[],,"[[1, 2], [19, 20]]","[[3, 4], [20, 23]]","['O', 'B-ASP', 'O', 'O', 'O', 'O', 'O', 'O', 'O', 'O', 'O', 'O', 'O', 'O', 'O', 'O', 'O', 'O', 'O', 'B-ASP', 'O', 'O', 'O']",375,2,1,8
"EXCELENTE PRODUTO E A ENTREGA MELHOR AINDA, ESTÁ DE PARABENS TODOS QUE FAZEM AS AMERICANAS.COM","['EXCELENTE', 'PRODUTO', 'E', 'A', 'ENTREGA', 'MELHOR', 'AINDA', ',', 'ESTÁ', 'DE', 'PARABENS', 'TODOS', 'QUE', 'FAZEM', 'AS', 'AMERICANAS.COM']","['produto', 'entrega']","['excelente', 'melhor ainda']",[],[],,"[[1, 2], [4, 5]]","[[0, 1], [5, 7]]","['O', 'B-ASP', 'O', 'O', 'B-ASP', 'O', 'O', 'O', 'O', 'O', 'O', 'O', 'O', 'O', 'O', 'O']",11,2,1,8
"O produto é excelente, uma das melhores marcas do mercado... A velocidade de acesso às funções de smart tv é bem razoável, tratando se de um aparelho nao tao caro., Entretanto, um ponto negativo são os pés(base) para quem for utilizá-lo em cima de algum objeto, rack ou estante, pois são 2 pés separados, um em cada ponta do objeto e um pouco fracos.","['O', 'produto', 'é', 'excelente', ',', 'uma', 'das', 'melhores', 'marcas', 'do', 'mercado', '...', 'A', 'velocidade', 'de', 'acesso', 'à', 's', 'funções', 'de', 'smart', 'tv', 'é', 'bem', 'razoável', ',', 'tratando', 'se', 'de', 'um', 'aparelho', 'nao', 'tao', 'caro', '.', ',', 'Entretanto', ',', 'um', 'ponto', 'negativo', 'são', 'os', 'pés(base', ')', 'para', 'quem', 'for', 'utilizá-lo', 'em', 'cima', 'de', 'algum', 'objeto', ',', 'rack', 'ou', 'estante', ',', 'pois', 'são', '2', 'pés', 'separados', ',', 'um', 'em', 'cada', 'ponta', 'do', 'objeto', 'e', 'um', 'pouco', 'fracos', '.']","['produto', 'funções de smart tv', 'pés']","['excelente', 'bem razoável', 'ponto negativo']",[],[],,"[[1, 2], [18, 22], [62, 63]]","[[3, 4], [23, 25], [39, 41]]","['O', 'B-ASP', 'O', 'O', 'O', 'O', 'O', 'O', 'O', 'O', 'O', 'O', 'O', 'O', 'O', 'O', 'O', 'O', 'B-ASP', 'I-ASP', 'I-ASP', 'I-ASP', 'O', 'O', 'O', 'O', 'O', 'O', 'O', 'O', 'O', 'O', 'O', 'O', 'O', 'O', 'O', 'O', 'O', 'O', 'O', 'O', 'O', 'O', 'O', 'O', 'O', 'O', 'O', 'O', 'O', 'O', 'O', 'O', 'O', 'O', 'O', 'O', 'O', 'O', 'O', 'O', 'B-ASP', 'O', 'O', 'O', 'O', 'O', 'O', 'O', 'O', 'O', 'O', 'O', 'O', 'O']",1037,3,1,8
"Já tinha uma televisão Sansung e gostava, por isso resolvi comprar novamente da mesma marca, porém esse modelo é muito inferior, o som é ruim, muito baixo e o acesso ao usb é super lento. Resumindo, fiquei decepcionada com o produto.","['Já', 'tinha', 'uma', 'televisão', 'Sansung', 'e', 'gostava', ',', 'por', 'isso', 'resolvi', 'comprar', 'novamente', 'da', 'mesma', 'marca', ',', 'porém', 'esse', 'modelo', 'é', 'muito', 'inferior', ',', 'o', 'som', 'é', 'ruim', ',', 'muito', 'baixo', 'e', 'o', 'acesso', 'a', 'o', 'usb', 'é', 'super', 'lento', '.', 'Resumindo', ',', 'fiquei', 'decepcionada', 'com', 'o', 'produto', '.']","['modelo', 'som', 'usb', 'produto']","['muito inferior', 'ruim', 'super lento', 'decepcionada']",[],[],COMPARAÇÃO,"[[19, 20], [25, 26], [36, 37], [47, 48]]","[[21, 23], [27, 28], [38, 40], [44, 45]]","['O', 'O', 'O', 'O', 'O', 'O', 'O', 'O', 'O', 'O', 'O', 'O', 'O', 'O', 'O', 'O', 'O', 'O', 'O', 'B-ASP', 'O', 'O', 'O', 'O', 'O', 'B-ASP', 'O', 'O', 'O', 'O', 'O', 'O', 'O', 'O', 'O', 'O', 'B-ASP', 'O', 'O', 'O', 'O', 'O', 'O', 'O', 'O', 'O', 'O', 'B-ASP', 'O']",886,4,1,8
O produto satisfez plenamente nossas expectativas. Basta ligar e começar a usar . Foi entregue em perfeitas condições antes do prazo estipulado no site.,"['O', 'produto', 'satisfez', 'plenamente', 'nossas', 'expectativas', '.', 'Basta', 'ligar', 'e', 'começar', 'a', 'usar', '.', 'Foi', 'entregue', 'em', 'perfeitas', 'condições', 'antes', 'do', 'prazo', 'estipulado', 'no', 'site', '.']",['produto'],['satisfez plenamente nossas expectativas'],"['entrega', 'entrega']","['perfeitas condições', 'antes do prazo']",,"[[1, 2]]","[[2, 6]]","['O', 'B-ASP', 'O', 'O', 'O', 'O', 'O', 'O', 'O', 'O', 'O', 'O', 'O', 'O', 'O', 'O', 'O', 'O', 'O', 'O', 'O', 'O', 'O', 'O', 'O', 'O']",248,1,1,8
Distorção de cores na diagonal . Manual com letras muito pequenas.,"['Distorção', 'de', 'cores', 'na', 'diagonal', '.', 'Manual', 'com', 'letras', 'muito', 'pequenas', '.']",['manual'],['letras muito pequenas'],['imagem'],['distorção'],,"[[6, 7]]","[[8, 11]]","['O', 'O', 'O', 'O', 'O', 'O', 'B-ASP', 'O', 'O', 'O', 'O', 'O']",174,1,1,8
Excelente Produto. É a terceira Smart TV Samsung que adquiri.,"['Excelente', 'Produto', '.', 'É', 'a', 'terceira', 'Smart', 'TV', 'Samsung', 'que', 'adquiri', '.']",['produto'],['excelente'],[],[],,"[[1, 2]]","[[0, 1]]","['O', 'B-ASP', 'O', 'O', 'O', 'O', 'O', 'O', 'O', 'O', 'O', 'O']",365,1,1,8
"A tv e bem leve e compacta. Executa o smart hub sem problemas. Liga bem rapido. So deixa a desejar no som, que na minha opiniao bem fraquinho, alem de ser baixo, mas para um quarto, esta bom.. A entrega foi super rápida!","['A', 'tv', 'e', 'bem', 'leve', 'e', 'compacta', '.', 'Executa', 'o', 'smart', 'hub', 'sem', 'problemas', '.', 'Liga', 'bem', 'rapido', '.', 'So', 'deixa', 'a', 'desejar', 'no', 'som', ',', 'que', 'na', 'minha', 'opiniao', 'bem', 'fraquinho', ',', 'alem', 'de', 'ser', 'baixo', ',', 'mas', 'para', 'um', 'quarto', ',', 'esta', 'bom', '..', 'A', 'entrega', 'foi', 'super', 'rápida', '!']","['smart hub', 'som', 'som', 'entrega']","['sem problemas', 'deixa a desejar', 'bem fraquinho', 'super rápida']","['peso', 'tamanho', 'processamento', 'som']","['bem leve', 'compacta', 'liga bem rapido', 'alem de ser baixo']",,"[[10, 12], [24, 25], [24, 25], [47, 48]]","[[12, 14], [20, 23], [30, 32], [49, 51]]","['O', 'O', 'O', 'O', 'O', 'O', 'O', 'O', 'O', 'O', 'B-ASP', 'I-ASP', 'O', 'O', 'O', 'O', 'O', 'O', 'O', 'O', 'O', 'O', 'O', 'O', 'B-ASP', 'O', 'O', 'O', 'O', 'O', 'O', 'O', 'O', 'O', 'O', 'O', 'O', 'O', 'O', 'O', 'O', 'O', 'O', 'O', 'O', 'O', 'O', 'B-ASP', 'O', 'O', 'O', 'O']",876,3,1,8
"Comprei no site da Americanas, foi tudo perfeito. ENTREGA ANTES DO PRAZO, RECEBI MEIA HORA ANTES DO JOGO DO BRASIL!! A tv é perfeita em tudo, vem tudo certinho, toda lacrada, impecável! Áudio, imagem, apps, wifi, internet.... eh um celular gigante.... amei RECOMENDO MUITO /SUPER RECOMENDO","['Comprei', 'no', 'site', 'da', 'Americanas', ',', 'foi', 'tudo', 'perfeito', '.', 'ENTREGA', 'ANTES', 'DO', 'PRAZO', ',', 'RECEBI', 'MEIA', 'HORA', 'ANTES', 'DO', 'JOGO', 'DO', 'BRASIL', '!', '!', 'A', 'tv', 'é', 'perfeita', 'em', 'tudo', ',', 'vem', 'tudo', 'certinho', ',', 'toda', 'lacrada', ',', 'impecável', '!', 'Áudio', ',', 'imagem', ',', 'apps', ',', 'wifi', ',', 'internet', '....', 'eh', 'um', 'celular', 'gigante', '....', 'amei', 'RECOMENDO', 'MUITO', '/SUPER', 'RECOMENDO']","['entrega', 'tv']","['antes do prazo', 'perfeita em tudo']","['produto', 'produto']","['tudo perfeito', 'recomendo muito /super recomendo']",,"[[10, 11], [26, 27]]","[[11, 14], [28, 31]]","['O', 'O', 'O', 'O', 'O', 'O', 'O', 'O', 'O', 'O', 'B-ASP', 'O', 'O', 'O', 'O', 'O', 'O', 'O', 'O', 'O', 'O', 'O', 'O', 'O', 'O', 'O', 'B-ASP', 'O', 'O', 'O', 'O', 'O', 'O', 'O', 'O', 'O', 'O', 'O', 'O', 'O', 'O', 'O', 'O', 'O', 'O', 'O', 'O', 'O', 'O', 'O', 'O', 'O', 'O', 'O', 'O', 'O', 'O', 'O', 'O', 'O', 'O']",896,2,1,8
O produto é bom e vale a pena comprar! Ainda mais que peguei um promoção com 10% de desconto.,"['O', 'produto', 'é', 'bom', 'e', 'vale', 'a', 'pena', 'comprar', '!', 'Ainda', 'mais', 'que', 'peguei', 'um', 'promoção', 'com', '10', '%', 'de', 'desconto', '.']",['produto'],['bom'],[],[],,"[[1, 2]]","[[3, 4]]","['O', 'B-ASP', 'O', 'O', 'O', 'O', 'O', 'O', 'O', 'O', 'O', 'O', 'O', 'O', 'O', 'O', 'O', 'O', 'O', 'O', 'O', 'O']",259,1,1,8
"É uma TV boa na questão do preço, tenhe boa qualidade , excelente imagem o áudio não é uns dos melhores é um pouco lenta como Smart, mas mesmo assim funciona bem.","['É', 'uma', 'TV', 'boa', 'na', 'questão', 'do', 'preço', ',', 'tenhe', 'boa', 'qualidade', ',', 'excelente', 'imagem', 'o', 'áudio', 'não', 'é', 'uns', 'dos', 'melhores', 'é', 'um', 'pouco', 'lenta', 'como', 'Smart', ',', 'mas', 'mesmo', 'assim', 'funciona', 'bem', '.']","['tv', 'preço', 'imagem', 'áudio', 'smart']","['boa', 'boa', 'excelente', 'não é uns dos melhores', 'lenta']",['produto'],['funciona bem'],,"[[2, 3], [7, 8], [14, 15], [16, 17], [27, 28]]","[[3, 4], [10, 11], [13, 14], [17, 22], [25, 26]]","['O', 'O', 'B-ASP', 'O', 'O', 'O', 'O', 'B-ASP', 'O', 'O', 'O', 'O', 'O', 'O', 'B-ASP', 'O', 'B-ASP', 'O', 'O', 'O', 'O', 'O', 'O', 'O', 'O', 'O', 'O', 'B-ASP', 'O', 'O', 'O', 'O', 'O', 'O', 'O']",1017,5,1,8
Sou de SC e chegou em 4 dias .... A entrega mais rápida que ja vi... Em perfeitas condições... Parabéns ao Shoptime..,"['Sou', 'de', 'SC', 'e', 'chegou', 'em', '4', 'dias', '....', 'A', 'entrega', 'mais', 'rápida', 'que', 'ja', 'vi', '...', 'Em', 'perfeitas', 'condições', '...', 'Parabéns', 'a', 'o', 'Shoptime', '..']",['entrega'],['mais rápida que ja vi'],['entrega'],['perfeitas condições'],,"[[10, 11]]","[[11, 16]]","['O', 'O', 'O', 'O', 'O', 'O', 'O', 'O', 'O', 'O', 'B-ASP', 'O', 'O', 'O', 'O', 'O', 'O', 'O', 'O', 'O', 'O', 'O', 'O', 'O', 'O', 'O']",42,1,1,8
"A televisão atende às expectativas mas logo assim que acabou a garantia de 1 ano, ela já deu problema e o valor estimado do conserto foi equivalente à metade do valor da TV.","['A', 'televisão', 'atende', 'à', 's', 'expectativas', 'mas', 'logo', 'assim', 'que', 'acabou', 'a', 'garantia', 'de', '1', 'ano', ',', 'ela', 'já', 'deu', 'problema', 'e', 'o', 'valor', 'estimado', 'do', 'conserto', 'foi', 'equivalente', 'à', 'metade', 'do', 'valor', 'da', 'TV', '.']",['televisão'],['atende às expectativas'],['produto'],['deu problema'],,"[[1, 2]]","[[2, 6]]","['O', 'B-ASP', 'O', 'O', 'O', 'O', 'O', 'O', 'O', 'O', 'O', 'O', 'O', 'O', 'O', 'O', 'O', 'O', 'O', 'O', 'O', 'O', 'O', 'O', 'O', 'O', 'O', 'O', 'O', 'O', 'O', 'O', 'O', 'O', 'O', 'O']",907,1,1,8
"oTIMO CUSTO BENEFICIO,IMAGEM PERFEITA, E A ENTREGA SUPER RAPIDA,ANTES DO PRAZO.","['oTIMO', 'CUSTO', 'BENEFICIO', ',', 'IMAGEM', 'PERFEITA', ',', 'E', 'A', 'ENTREGA', 'SUPER', 'RAPIDA', ',', 'ANTES', 'DO', 'PRAZO', '.']","['custo beneficio', 'imagem', 'entrega']","['otimo', 'perfeita', 'super rapida']",[],[],,"[[1, 3], [4, 5], [9, 10]]","[[0, 1], [5, 6], [10, 12]]","['O', 'B-ASP', 'I-ASP', 'O', 'B-ASP', 'O', 'O', 'O', 'O', 'B-ASP', 'O', 'O', 'O', 'O', 'O', 'O', 'O']",353,3,1,8
"Ótima TV, superou minhas expectativas. Simples e fácil de usar, imagem, som, conexão e tudo mais. Estou satisfeita!","['Ótima', 'TV', ',', 'superou', 'minhas', 'expectativas', '.', 'Simples', 'e', 'fácil', 'de', 'usar', ',', 'imagem', ',', 'som', ',', 'conexão', 'e', 'tudo', 'mais', '.', 'Estou', 'satisfeita', '!']",[],[],[],[],,[],[],"['O', 'O', 'O', 'O', 'O', 'O', 'O', 'O', 'O', 'O', 'O', 'O', 'O', 'O', 'O', 'O', 'O', 'O', 'O', 'O', 'O', 'O', 'O', 'O', 'O']",268,0,0,8
"Compra maravilhosa. Como sempre a lojas Americanas surpreende. Comprei a tv no domingo dia 24 de abril e recebi na quarta dia 27 de abril, e olha que moro no interior de MG. Produto muito bem embalado. Melhor preço e entrega. Adorei a compra e recomendo.","['Compra', 'maravilhosa', '.', 'Como', 'sempre', 'a', 'lojas', 'Americanas', 'surpreende', '.', 'Comprei', 'a', 'tv', 'no', 'domingo', 'dia', '24', 'de', 'abril', 'e', 'recebi', 'na', 'quarta', 'dia', '27', 'de', 'abril', ',', 'e', 'olha', 'que', 'moro', 'no', 'interior', 'de', 'MG', '.', 'Produto', 'muito', 'bem', 'embalado', '.', 'Melhor', 'preço', 'e', 'entrega', '.', 'Adorei', 'a', 'compra', 'e', 'recomendo', '.']","['preço', 'entrega']","['melhor', 'melhor']",[],[],,"[[43, 44], [45, 46]]","[[42, 43], [42, 43]]","['O', 'O', 'O', 'O', 'O', 'O', 'O', 'O', 'O', 'O', 'O', 'O', 'O', 'O', 'O', 'O', 'O', 'O', 'O', 'O', 'O', 'O', 'O', 'O', 'O', 'O', 'O', 'O', 'O', 'O', 'O', 'O', 'O', 'O', 'O', 'O', 'O', 'O', 'O', 'O', 'O', 'O', 'O', 'B-ASP', 'O', 'B-ASP', 'O', 'O', 'O', 'O', 'O', 'O', 'O']",1008,2,1,8
Produto atendeu minhas expectativas. Muito Boa a Qualidade e funções oferecidas.,"['Produto', 'atendeu', 'minhas', 'expectativas', '.', 'Muito', 'Boa', 'a', 'Qualidade', 'e', 'funções', 'oferecidas', '.']","['produto', 'funções']","['atendeu minhas expectativas', 'muito boa']",['produto'],['muito boa a qualidade'],,"[[0, 1], [10, 11]]","[[1, 4], [5, 7]]","['B-ASP', 'O', 'O', 'O', 'O', 'O', 'O', 'O', 'O', 'O', 'B-ASP', 'O', 'O']",162,2,1,8
porem estou sem tempo quase nao estou parando em casa para ficar configurando e vendo o que ela me ajudaria sendo na parte Smart pois a imagem e audio estao otimos falta testar o recurso wifi para ver se e rapido e netflix alem de internet em geral logo logo terei tempo,"['porem', 'estou', 'sem', 'tempo', 'quase', 'nao', 'estou', 'parando', 'em', 'casa', 'para', 'ficar', 'configurando', 'e', 'vendo', 'o', 'que', 'ela', 'me', 'ajudaria', 'sendo', 'na', 'parte', 'Smart', 'pois', 'a', 'imagem', 'e', 'audio', 'estao', 'otimos', 'falta', 'testar', 'o', 'recurso', 'wifi', 'para', 'ver', 'se', 'e', 'rapido', 'e', 'netflix', 'alem', 'de', 'internet', 'em', 'geral', 'logo', 'logo', 'terei', 'tempo']","['imagem', 'audio']","['otimos', 'otimos']",[],[],,"[[26, 27], [28, 29]]","[[30, 31], [30, 31]]","['O', 'O', 'O', 'O', 'O', 'O', 'O', 'O', 'O', 'O', 'O', 'O', 'O', 'O', 'O', 'O', 'O', 'O', 'O', 'O', 'O', 'O', 'O', 'O', 'O', 'O', 'B-ASP', 'O', 'B-ASP', 'O', 'O', 'O', 'O', 'O', 'O', 'O', 'O', 'O', 'O', 'O', 'O', 'O', 'O', 'O', 'O', 'O', 'O', 'O', 'O', 'O', 'O', 'O']",1027,2,1,8
"Começando pelo valor muito bom, a entrega nem se fala. A Americanas sempre surpreende na rapidez das entregas. Produto de ótima qualidade, embalado corretamente e atendeu as expectativas.","['Começando', 'pelo', 'valor', 'muito', 'bom', ',', 'a', 'entrega', 'nem', 'se', 'fala', '.', 'A', 'Americanas', 'sempre', 'surpreende', 'na', 'rapidez', 'das', 'entregas', '.', 'Produto', 'de', 'ótima', 'qualidade', ',', 'embalado', 'corretamente', 'e', 'atendeu', 'as', 'expectativas', '.']","['valor', 'entrega', 'produto', 'produto']","['muito bom', 'nem se fala', 'ótima qualidade', 'atendeu as expectativas']",[],[],,"[[2, 3], [7, 8], [21, 22], [21, 22]]","[[3, 5], [8, 11], [23, 25], [29, 32]]","['O', 'O', 'B-ASP', 'O', 'O', 'O', 'O', 'B-ASP', 'O', 'O', 'O', 'O', 'O', 'O', 'O', 'O', 'O', 'O', 'O', 'O', 'O', 'B-ASP', 'O', 'O', 'O', 'O', 'O', 'O', 'O', 'O', 'O', 'O', 'O']",608,3,1,8
"Excelente produto, linda e foi entregue bem antes do prazo","['Excelente', 'produto', ',', 'linda', 'e', 'foi', 'entregue', 'bem', 'antes', 'do', 'prazo']",['produto'],['excelente'],['entrega'],['entregue bem antes do prazo'],,"[[1, 2]]","[[0, 1]]","['O', 'B-ASP', 'O', 'O', 'O', 'O', 'O', 'O', 'O', 'O', 'O']",644,1,1,8
Imagem e som com qualidade. O Wi-Fi funciona perfeitamente. Recomendo pelo ótimo custo beneficio para TVde 32”.,"['Imagem', 'e', 'som', 'com', 'qualidade', '.', 'O', 'Wi-Fi', 'funciona', 'perfeitamente', '.', 'Recomendo', 'pelo', 'ótimo', 'custo', 'beneficio', 'para', 'TVde', '32', '”', '.']","['imagem', 'som', 'wi-fi', 'custo beneficio']","['qualidade', 'qualidade', 'funciona perfeitamente', 'ótimo']",['produto'],['recomendo'],,"[[0, 1], [2, 3], [7, 8], [14, 16]]","[[4, 5], [4, 5], [8, 10], [13, 14]]","['B-ASP', 'O', 'B-ASP', 'O', 'O', 'O', 'O', 'B-ASP', 'O', 'O', 'O', 'O', 'O', 'O', 'B-ASP', 'I-ASP', 'O', 'O', 'O', 'O', 'O']",142,4,1,8
Essa smart tv é muito boa... Atendeu perfeitamente nossa expectativa... Realmente um bela experiência de compra nas Americanas. Sou mais admirador ainda da Samsung.,"['Essa', 'smart', 'tv', 'é', 'muito', 'boa', '...', 'Atendeu', 'perfeitamente', 'nossa', 'expectativa', '...', 'Realmente', 'um', 'bela', 'experiência', 'de', 'compra', 'nas', 'Americanas', '.', 'Sou', 'mais', 'admirador', 'ainda', 'da', 'Samsung', '.']",['smart tv'],['muito boa'],['produto'],['atendeu perfeitamente nossa expectativa'],,"[[1, 3]]","[[4, 6]]","['O', 'B-ASP', 'I-ASP', 'O', 'O', 'O', 'O', 'O', 'O', 'O', 'O', 'O', 'O', 'O', 'O', 'O', 'O', 'O', 'O', 'O', 'O', 'O', 'O', 'O', 'O', 'O', 'O', 'O']",598,1,1,8
"A TV é boa, pena que tem poucas portas de saída!!!","['A', 'TV', 'é', 'boa', ',', 'pena', 'que', 'tem', 'poucas', 'portas', 'de', 'saída', '!', '!', '!']","['tv', 'portas de saída']","['boa', 'poucas']",[],[],,"[[1, 2], [9, 12]]","[[3, 4], [8, 9]]","['O', 'B-ASP', 'O', 'O', 'O', 'O', 'O', 'O', 'O', 'B-ASP', 'I-ASP', 'I-ASP', 'O', 'O', 'O']",708,2,1,8
"agora a minha casa só tem samsung, imagem maravilhosa, facil de usar. gostei muito","['agora', 'a', 'minha', 'casa', 'só', 'tem', 'samsung', ',', 'imagem', 'maravilhosa', ',', 'facil', 'de', 'usar', '.', 'gostei', 'muito']",['imagem'],['maravilhosa'],"['usabilidade', 'produto']","['facil de usar', 'gostei muito']",,"[[8, 9]]","[[9, 10]]","['O', 'O', 'O', 'O', 'O', 'O', 'O', 'O', 'B-ASP', 'O', 'O', 'O', 'O', 'O', 'O', 'O', 'O']",786,1,1,8
Ótimo produto! De facil manuseio. Som bom para uma TV. A função de conexao com smartphone/outros aparelhos funciona perfeitamente! Otima qualidade e entrega rapida. Cumpre o que promete.,"['Ótimo', 'produto', '!', 'De', 'facil', 'manuseio', '.', 'Som', 'bom', 'para', 'uma', 'TV', '.', 'A', 'função', 'de', 'conexao', 'com', 'smartphone', '/', 'outros', 'aparelhos', 'funciona', 'perfeitamente', '!', 'Otima', 'qualidade', 'e', 'entrega', 'rapida', '.', 'Cumpre', 'o', 'que', 'promete', '.']","['produto', 'manuseio', 'som', 'função de conexao com smartphone/outros', 'entrega']","['ótimo', 'facil', 'bom', 'funciona perfeitamente', 'rapida']",['produto'],['otima qualidade'],,"[[1, 2], [5, 6], [7, 8], [14, 21], [28, 29]]","[[0, 1], [4, 5], [8, 9], [22, 24], [29, 30]]","['O', 'B-ASP', 'O', 'O', 'O', 'B-ASP', 'O', 'B-ASP', 'O', 'O', 'O', 'O', 'O', 'O', 'B-ASP', 'I-ASP', 'I-ASP', 'I-ASP', 'I-ASP', 'I-ASP', 'I-ASP', 'O', 'O', 'O', 'O', 'O', 'O', 'O', 'B-ASP', 'O', 'O', 'O', 'O', 'O', 'O', 'O']",743,5,1,8
